1	6575/6575	101	0	data/refs/0.fa	CP001472.1 Acidobacterium capsulatum ATCC 51196, complete genome
1	1479/1479	183	0	data/refs/1.fa	CP001941.1 Aciduliprofundum boonei T469, complete genome
1	6998/6998	41	0	data/refs/2.fa	CP001071.1 Akkermansia muciniphila ATCC BAA-835, complete genome
1	2416/2416	195	0	data/refs/3.fa	AE000782.1 Archaeoglobus fulgidus DSM 4304, complete genome
1	16716/16716	41	0	data/refs/4.fa	AE015928.1 Bacteroides thetaiotaomicron VPI-5482, complete genome
1	18836/18836	39	0	data/refs/5.fa	CP000139.1 Bacteroides vulgatus ATCC 8482, complete genome
0.999141	9774/10038	10	0	data/refs/6.fa	[76 seqs] NZ_JGWU01000001.1 Bordetella bronchiseptica D989 ctg7180000008197, whole genome shotgun sequence [...]
0.999961	28621/28656	19	0	data/refs/7.fa	[3 seqs] NC_007951.1 Burkholderia xenovorans LB400 chromosome 1, complete sequence [...]
1	13680/13680	127	0	data/refs/8.fa	CP000679.1 Caldicellulosiruptor saccharolyticus DSM 8903, complete genome
1	38854/38854	62	0	data/refs/9.fa	[3 seqs] NZ_FWDH01000003.1 Caldicellulosiruptor bescii strain MACB1021, whole genome shotgun sequence [...]
0.999884	10573/10611	100	0	data/refs/10.fa	CP001097.1 Chlorobium limicola DSM 245, complete genome
1	24190/24190	69	0	data/refs/11.fa	CP000492.1 Chlorobium phaeobacteroides DSM 266, complete genome
1	4133/4133	103	0	data/refs/12.fa	CP000607.1 Chlorobium phaeovibrioides DSM 265, complete genome
1	2852/2852	64	0	data/refs/13.fa	AE006470.1 Chlorobium tepidum TLS, complete genome
0.999968	20223/20243	36	0	data/refs/14.fa	CP000909.1 Chloroflexus aurantiacus J-10-fl, complete genome
1	29382/29382	57	0	data/refs/15.fa	CP000568.1 Clostridium thermocellum ATCC 27405, complete genome
1	13886/13886	52	0	data/refs/16.fa	[4 seqs] NZ_CP015081.1 Deinococcus radiodurans R1 chromosome 1, complete sequence [...]
0.999057	6606/6802	55	0	data/refs/17.fa	[2 seqs] NC_008751.1 Desulfovibrio vulgaris DP4, complete genome [...]
1	903/903	54	0	data/refs/18.fa	CP001251.1 Dictyoglomus turgidum DSM 6724, complete genome
0.972847	6065/14238	61	0	data/refs/19.fa	[9 seqs] NZ_KE136524.1 Enterococcus faecalis V583 acyDH-supercont2.1, whole genome shotgun sequence [...]
0.969588	4619/12032	34	0	data/refs/20.fa	AE009951.2 Fusobacterium nucleatum subsp. nucleatum ATCC 25586, complete genome
1	1379/1379	86	0	data/refs/21.fa	AP009153.1 Gemmatimonas aurantiaca T-27 DNA, complete genome
1	4638/4638	147	0	data/refs/22.fa	AE017180.2 Geobacter sulfurreducens PCA, complete genome
1	10882/10882	77	0	data/refs/23.fa	[5 seqs] NC_013968.1 Haloferax volcanii DS2 plasmid pHV1, complete sequence [...]
1	19049/19049	21	0	data/refs/24.fa	[3 seqs] NC_009972.1 Herpetosiphon aurantiacus DSM 785, complete genome [...]
1	534/534	113	0	data/refs/25.fa	CP001130.1 Hydrogenobaculum sp. Y04AAS1, complete genome
1	466/466	35	0	data/refs/26.fa	CP000816.1 Ignicoccus hospitalis KIN4/I, complete genome
1	6253/6253	47	0	data/refs/27.fa	CP001013.1 Leptothrix cholodnii SP-6, complete genome
1	1671/1671	80	0	data/refs/28.fa	[3 seqs] NC_000909.1 Methanocaldococcus jannaschii DSM 2661, complete genome [...]
1	5504/5504	105	0	data/refs/29.fa	CP000609.1 Methanococcus maripaludis C5, complete genome
1	5373/5373	103	0	data/refs/30.fa	BX950229.1 Methanococcus maripaludis strain S2, complete sequence
1	137/137	61	0	data/refs/31.fa	AE009439.1 Methanopyrus kandleri AV19, complete genome
1	45969/45969	29	0	data/refs/32.fa	AE010299.1 Methanosarcina acetivorans str. C2A, complete genome
0.996777	38/42	411	0	data/refs/33.fa	NC_005213.1 Nanoarchaeum equitans Kin4-M chromosome, complete genome
1	12435/12435	189	0	data/refs/34.fa	AL954747.1 Nitrosomonas europaea ATCC 19718, complete genome
1	21445/21445	55	0	data/refs/35.fa	[7 seqs] NC_003272.1 Nostoc sp. PCC 7120 DNA, complete genome [...]
1	17466/17466	65	0	data/refs/36.fa	CP001110.1 Pelodictyon phaeoclathratiforme BU-1, complete genome
1	17430/17430	50	0	data/refs/37.fa	AP009380.1 Porphyromonas gingivalis ATCC 33277 DNA, complete genome
1	3196/3196	115	0	data/refs/38.fa	AE009441.1 Pyrobaculum aerophilum str. IM2, complete genome
1	254/254	67	0	data/refs/39.fa	CP000660.1 Pyrobaculum arsenaticum DSM 13514, complete genome
1	150/150	86	0	data/refs/40.fa	CP000561.1 Pyrobaculum calidifontis JCM 11548, complete genome
1	3353/3353	177	0	data/refs/41.fa	AE009950.1 Pyrococcus furiosus DSM 3638, complete genome
1	279/279	145	0	data/refs/42.fa	BA000001.2 Pyrococcus horikoshii OT3 DNA, complete genome
1	20197/20197	182	0	data/refs/43.fa	BX119912.1 Rhodopirellula baltica SH 1 complete genome
1	8198/8198	28	0	data/refs/44.fa	[2 seqs] NC_003911.12 Ruegeria pomeroyi DSS-3, complete genome [...]
1	15438/15438	46	0	data/refs/45.fa	CP000850.1 Salinispora arenicola CNS-205, complete genome
0.999905	14182/14224	38	0	data/refs/46.fa	CP000667.1 Salinispora tropica CNB-440, complete genome
0.999991	20686/20692	29	0	data/refs/47.fa	[2 seqs] NC_009665.1 Shewanella baltica OS185, complete genome [...]
1	12303/12303	96	0	data/refs/48.fa	NC_010730.1 Sulfurihydrogenibium sp. YO3AOP1, complete genome
0.999853	11409/11461	58	0	data/refs/49.fa	[228 seqs] NZ_ABZS01000228.1 Sulfurihydrogenibium yellowstonense SS-5 gcontig_18, whole genome shotgun sequence [...]
1	21582/21582	51	0	data/refs/50.fa	CP000924.1 Thermoanaerobacter pseudethanolicus ATCC 33223, complete genome
1	555/555	135	0	data/refs/51.fa	CP000916.1 Thermotoga neapolitana DSM 4359, complete genome
1	1561/1561	396	0	data/refs/52.fa	CP000702.1 Thermotoga petrophila RKU-1, complete genome
1	2989/2989	323	0	data/refs/53.fa	CP000969.1 Thermotoga sp. RQ2, complete genome
1	318/318	79	0	data/refs/54.fa	CP001230.1 Persephonella marina EX-H1, complete genome
0.992395	955/1210	43	0	data/refs/55.fa	AE017221.1 Thermus thermophilus HB27, complete genome
1	3938/3938	71	0	data/refs/56.fa	AE017226.1 Treponema denticola ATCC 35405, complete genome
1	9624/9624	48	0	data/refs/57.fa	BX571656.1 Wolinella succinogenes DSM 1740, complete genome
0.997674	1162/1249	6	0	data/refs/58.fa	[30 seqs] NZ_KQ961402.1 Zymomonas mobilis strain ATCC 31823 Scaffold1, whole genome shotgun sequence [...]
1	7939/7939	231	0	data/refs/59.fa	[5 seqs] NZ_CH959311.1 Sulfitobacter sp. EE-36 scf_1099451318005, whole genome shotgun sequence [...]
1	14319/14319	241	0	data/refs/60.fa	[11 seqs] NZ_CH959317.1 Sulfitobacter sp. NAS-14.1 scf_1099451320472, whole genome shotgun sequence [...]
1	552/552	59	0	data/refs/61.fa	[47 seqs] NZ_DS996397.1 Desulfovibrio piger ATCC 29098 Scfld442, whole genome shotgun sequence [...]
1	10577/10577	130	0	data/refs/62.fa	BA000023.2 Sulfolobus tokodaii str. 7 DNA, complete genome
1	26620/26620	64	0	data/refs/63.fa	[4 seqs] NC_011663.1 Shewanella baltica OS223, complete genome [...]
0.917867	3509/50005	2	0	data/refs/65.fa	[3 seqs] NZ_CM004381.1 Escherichia coli strain 2014C-3250 plasmid unnamed1, whole genome shotgun sequence [...]
0.985901	1302/2022	77	0	data/refs/66.fa	[21 seqs] NZ_JNKC01000001.1 Proteiniclasticum ruminis DSM 24773 T487DRAFT_scaffold00001.1_C, whole genome shotgun sequence [...]
0.962015	575/1910	3	0	data/refs/67.fa	[79 seqs] NZ_JMRV01000049.1 Streptococcus parasanguinis strain C1A plasmid unnamed1 contig_49, whole genome shotgun sequence [...]
